Gender,District_Location,Education_Stream,Soft_Skills,Key_Skils,Current_semester,GPA,Experties_Preferred_GPA,Experties_preferred_tech_skills,Experties_preferred_Skills,Experties_Preferred_Career_Field,English_score,Ocean_Openness,Ocean_Conscientiousness,Ocean_Extraversion,Ocean_Agreeableness,Ocean_Neuroticism,Riasec_Realistic,Riasec_Investigative,Riasec_Artistic,Riasec_Social,Riasec_Enterprising,Riasec_Conventional,Learning_Style,Course_Recommendation,University_Recommendation,Skill_Gap_Score,Feedback_Score,Data_Consent,Timestamp
Female,Matara,Bio Stream,"Leadership, Responsibility, Integrity","HTML, CSS, React.js, Node.js",1Y2S,2.4,3.3,"MERN Stack, Redux, Docker, Git, Firebase;","Leadership, Confidence Catalyst",UI/UX Designer,66,3,1,3,2,5,1,3,1,10,7,2,Visual,,,,,,
Female,Anuradhapura,Maths Stream,"Problem Solving, Action-Oriented Fixer","Flutter, Dart, Firebase Auth, GetX/Bloc, Push Notifications, Google Maps, In-app Purchase",1Y2S,3.5,3.2,"Java, Spring Boot, MySQL, Git, REST APIs","Public Speaking, Stage Dominator",DevOps / Cloud Engineer,74,4,3,2,1,2,3,2,2,10,5,2,Kinesthetic,,,,,,
Male,Monaragala,Technology Stream,"Adaptability, Resilience, Positivity","Python, Scikit-learn, Pandas, SQL, Jupyter",2Y2S,3.4,3,"Python, Pandas","Emotional Intelligence, People Smart",Data Science & Analytics,50,5,1,5,1,1,3,6,6,8,1,3,Kinesthetic,,,,,,
Female,Vavuniya,Commerce Stream,"Emotional Intelligence, Exceptional","Java, Spring Boot, PostgreSQL, Docker, REST APIs",1Y1S,2.1,3.3,"Python, Pandas, Google Colab","Teamwork, Partnership, Trust;",Mobile App Developer,88,3,4,2,5,5,10,3,5,3,10,1,Visual,,,,,,
Male,Galle,Maths Stream,"Teamwork, Collaboration, Reliability","Git, Docker Desktop",1Y1S,2.2,3,"Kali Linux, Wireshark, Nmap, Python, Ethical Hacking;","Problem Solving, Troubleshooting, Ingenuity;",Frontend / Web Developer,100,2,4,4,4,3,7,6,4,5,8,9,Visual,,,,,,
Female,Ratnapura,Maths Stream,"Teamwork, Reliable Teammate","Java, Spring Boot, Microservices, Docker, Maven",2Y2S,2.9,3.2,"Python, Google Colab, Scikit-learn, Pandas, Jupyter","Public Speaking, Respect Commanding",Data Science & Analytics,88,2,5,5,2,1,9,6,9,3,10,5,Kinesthetic,,,,,,
Male,Matale,Bio Stream,"Time Management, Laser Focused","MERN Stack, TypeScript, Docker, Git, Redux",2Y2S,1.9,3.3,"Figma, Canva, Wireframing","Communication, Expression, Authenticity;",AI / Machine Learning Engineer,76,1,5,4,3,1,1,2,7,5,8,10,Visual,,,,,,
Female,Galle,Maths Stream,"Time Management, Excellent Planner","Node.js, Express.js, MongoDB",2Y1S,3.7,3.3,"Python, Pandas, Excel, Matplotlib","Critical Thinking, Precise Analyzer",Software Engineer / Backend,78,3,3,2,5,4,2,4,5,10,3,7,Visual,,,,,,
Male,Matale,Bio Stream,"Critical Thinking, Deep Thinker","HTML, CSS, Bootstrap",1Y1S,3.2,3.2,"Java, Spring Boot, Git, Docker, MySQL","Presentation Skills, Elite Speaker",Data Science & Analytics,45,2,3,5,3,3,2,6,9,1,9,4,Kinesthetic,,,,,,
Female,Batticaloa,Commerce Stream,"Leadership, Quiet Authority",Docker Desktop,1Y2S,2.9,3.3,"SQL, Python, Tableau, Power BI, Data Visualization;","Teamwork, Supportive Ally",DevOps / Cloud Engineer,43,2,5,2,5,2,9,6,2,9,8,8,Visual,,,,,,
Male,Mannar,Technology Stream,"Problem Solving, Rapid Resolution","SQL, Python, Pandas, Power BI, Tableau, Excel (Pivot, VLOOKUP), Statistics, Data Visualization",2Y1S,4.9,3,"Node.js, TypeScript, NestJS, GraphQL, Docker","Communication, Respectful Speaker",Mobile App Developer,57,2,4,2,4,3,4,3,9,10,3,5,Aural,,,,,,
Male,Trincomalee,Commerce Stream,"Time Management, Work Ethic, Attention to Detail","HTML5, CSS3, JavaScript ES6+, React.js, Tailwind CSS, Git, Responsive Design, Redux",1Y2S,2,3.2," HTML, CSS, React.js","Public Speaking, Influence, Motivation.",Frontend / Web Developer,94,1,4,4,4,1,6,7,3,6,2,10,Kinesthetic,,,,,,
Female,Trincomalee,Maths Stream,"Teamwork, Collaboration, Reliability","React.js, Node.js, Express.js, MongoDB, Redux, Docker, Git, JWT",2Y1S,2.7,3.2,"Python, Burp Suite, Kali Linux, Ethical Hacking","Leadership, Natural Force",Data Science & Analytics,75,2,4,1,3,1,1,5,8,3,8,4,Kinesthetic,,,,,,
Male,Anuradhapura,Maths Stream,"Public Speaking, Charisma, Presence","Python, Scikit-learn, XGBoost, SQL, Model Deployment",2Y1S,2.1,3,"SQL, Excel, Power BI","Emotional Intelligence, People Smart",DevOps / Cloud Engineer,90,4,5,3,4,5,3,9,2,6,10,8,Visual,,,,,,
Female,Gampaha,Bio Stream,"Leadership, Strategic Thinking, Mentoring","Flutter, Firebase",1Y1S,2.6,3.2,"HTML, CSS, JavaScript, React.js, Node.js","Presentation Skills, Graceful Presenter",Data Science & Analytics,86,5,1,5,2,2,3,4,7,7,3,4,Kinesthetic,,,,,,
Other,Kilinochchi,Maths Stream,"Creativity, Innovation, Risk-Taking","Python, Pandas, XGBoost, Model Evaluation",1Y1S,2,3.3,"Git, Docker","Problem Solving, Always Finds a Path",DevOps / Cloud Engineer,48,2,2,3,2,2,9,6,3,1,4,7,Mixed (Visual + Aural),,,,,,
Male,Batticaloa,Bio Stream,"Time Management, Efficiency, Focus","SQL, Power BI (Basic)",2Y2S,4,3.2,"Docker Desktop, Git","Adaptability, Unbreakable",Mobile App Developer,74,2,4,5,4,3,3,2,2,9,3,2,Mixed (Visual + Kinesthetic),,,,,,
Male,Ampara,Bio Stream,"Public Speaking, Respect Commanding","AWS, Serverless, Lambda, DynamoDB, API Gateway, CDK",1Y1S,2.7,3,"TensorFlow, PyTorch, Docker, FastAPI, AWS SageMaker;","Teamwork, Universal Connector",Data Science & Analytics,43,4,5,2,2,5,3,6,1,10,1,2,Visual,,,,,,
Male,Matale,Arts Stream,"Leadership, Calm Captain","Flutter, Dart, Firebase, Riverpod, REST APIs, Hive/Sqflite, App Deployment",2Y1S,1.1,3.3,"Kali Linux, Wireshark, Nmap, Python Scripting","Adaptability, Shapeshifts to Any Situation",IT / Technology Generalist,92,3,2,3,3,1,9,3,10,6,4,6,Visual,,,,,,
Male,Badulla,Commerce Stream,"Critical Thinking, Sharp & Fair","Java, MySQL, Git",1Y2S,3.2,3.3,"SQL, Python, Tableau, Power BI, Data Visualization","Problem Solving, Logic, Reasoning;",Data Science & Analytics,78,2,2,2,4,5,4,5,1,6,6,6,Read/Write,,,,,,
Male,Ratnapura,Bio Stream,"Creativity, Fresh Vision","AWS, Serverless, Lambda, S3, CloudFront",2Y2S,2.6,3,"React.js, Tailwind CSS, JavaScript, Responsive ","Communication, Respectful Speaker",UI/UX Designer,58,2,2,2,3,5,2,6,4,7,7,8,Mixed (Visual + Kinesthetic),,,,,,
Female,Kurunegala,Technology Stream,"Leadership, Vision, Inspiration","Flutter, Dart, Firebase, Provider, REST APIs, Git, Material Design",1Y2S,2.2,3.3,"Java, Spring Boot, Microservices, Git, Docker;","Problem Solving, Limitless Reasoning",Data Science & Analytics,85,3,5,4,3,2,7,2,8,10,3,9,Kinesthetic,,,,,,
Female,Matale,Arts Stream,"Communication, Active Listener","Figma, Prototyping, User Flows, A/B Testing",1Y2S,2.9,3,"HTML, CSS, React.js, Node.js, Express.js","Teamwork, Universal Connector",DevOps / Cloud Engineer,55,4,5,2,4,5,10,4,2,8,5,8,Visual,,,,,,
Male,Trincomalee,Technology Stream,"Leadership, King/Queen of World","MERN Stack, Redux, Docker, Git, Firebase",1Y2S,3.9,2.8,"Python Scripting, Metasploit, Kali Linux, OWASP;","Teamwork, Inclusiveness, Respect;",Mobile App Developer,90,5,1,2,3,5,8,5,9,8,2,10,Visual,,,,,,
Other,Anuradhapura,Arts Stream,"Adaptability, Unbreakable","Flutter, Dart, Firebase Auth, GetX/Bloc, Push Notifications, Google Maps, In-app Purchase",1Y1S,2.9,2.8,"Docker Desktop, Git","Public Speaking, Eloquence, Influence;",Data Science & Analytics,58,5,1,4,2,4,6,7,4,6,9,8,Aural,,,,,,
Female,Nuwara Eliya,Maths Stream,"Communication, Smooth & Natural","Node.js, Express.js",1Y2S,4.9,3.3,"React.js, Node.js, Express.js, MongoDB, Git;","Time Management, Controls Time",Software Engineer / Backend,75,3,1,5,4,1,2,7,2,9,9,3,Visual,,,,,,
Female,Polonnaruwa,Technology Stream,"Critical Thinking, Sharp Logic","SQL, Python, Power BI, Excel (Power Query), Statistics, Data Visualization",2Y1S,2.1,3.2,"HTML, CSS, Bootstrap, JavaScript","Critical Thinking, Top-Tier Logic",Data Science & Analytics,88,5,1,3,4,2,9,1,1,9,5,7,Aural,,,,,,
Female,Kegalle,Commerce Stream,"Problem Solving, Smart Analyst","Git, Docker Desktop, Basic Bash, VS Code",1Y2S,1.5,3,"AWS VPC, IAM, ECS, CloudWatch, Terraform;","Time Management, Prioritizes Perfectly",Data Science & Analytics,83,4,3,5,3,5,6,8,5,3,2,6,Mixed (Visual + Kinesthetic),,,,,,
Female,Monaragala,Commerce Stream,"Presentation Skills, Impactful Delivery","Python, Jupyter",1Y2S,3.7,3.3,"Java, Python, Spring Boot, Git, MySQL;","Creativity, Dream Architect",DevOps / Cloud Engineer,75,1,1,4,5,2,1,3,6,7,3,10,Kinesthetic,,,,,,
Male,Matara,Technology Stream,"Leadership, Delegation, Conflict Management","Python, FastAPI, PostgreSQL, Docker, Git",2Y2S,3,3,"AWS, Serverless, Lambda, DynamoDB, API Gateway;","Leadership, Iconic",Cybersecurity / Network Engineer,78,2,2,5,4,2,5,5,9,1,6,2,Visual,,,,,,
Male,Gampaha,Maths Stream,"Teamwork, Harmony Builder","AWS Free Tier, S3, EC2, IAM Basics, AWS Console",1Y1S,4.4,3.2,"Python, Scikit-learn, Pandas, XGBoost, Hyperparameter Tuning;","Adaptability, Multi-Mode Thinker",Data Science & Analytics,55,5,2,4,3,2,5,1,1,7,1,8,Aural,,,,,,
Male,Trincomalee,Arts Stream,"Critical Thinking, Insight, Perception","PyTorch, TensorFlow, Scikit-learn, FastAPI, Docker",2Y1S,4,3,"Java, Git, VS Code, MySQL","Presentation Skills, Elite Speaker",DevOps / Cloud Engineer,85,2,3,3,4,2,1,9,10,6,10,1,Visual,,,,,,
Male,Galle,Maths Stream,"Public Speaking, Articulation, Conviction","Python, Pandas, Scikit-learn, TensorFlow/Keras, SQL, Jupyter, Statistics, Model Evaluation",2Y1S,2.2,3,"Burp Suite, Wireshark, Python, OWASP Top 10","Public Speaking, Charismatic Presence",AI / Machine Learning Engineer,86,1,2,3,1,3,7,10,5,4,6,1,Visual,,,,,,
Female,Mullaitivu,Bio Stream,"Communication, Active Listening, Confidence","Python, R, Scikit-learn, XGBoost, SQL, Feature Engineering",2Y2S,4.9,3.3,"Java, MySQL","Leadership, Quiet Authority",Data Science & Analytics,64,4,3,3,1,1,5,1,4,7,9,10,Visual,,,,,,
Female,Vavuniya,Arts Stream,"Problem Solving, Creative Fixer","Python Scripting, Metasploit, Kali Linux, SIEM",2Y1S,1,3.2,"HTML, CSS, React.js, Node.js, MongoDB","Problem Solving, Initiative, Resilience",Mobile App Developer,70,3,2,3,4,5,10,7,6,2,9,3,Aural,,,,,,
Female,Galle,Maths Stream,"Communication, Transparency, Honesty","Python, Matplotlib",2Y2S,3.7,3,"React.js, Node.js, Express.js, MongoDB, Redux","Critical Thinking, Deep Analyzer",Data Science & Analytics,95,2,3,3,5,2,7,7,7,1,3,9,Visual,,,,,,
Female,Polonnaruwa,Bio Stream,"Problem Solving, Solution-Oriented, Persistence","Figma, Adobe XD, User Testing, Accessibility",2Y1S,3.7,2.8,"Java, Python, VS Code, Git, MySQL","Teamwork, Legendary",Data Science & Analytics,76,3,3,3,2,2,8,2,4,3,7,5,Aural,,,,,,
Male,Kurunegala,Technology Stream,"Communication, Clarity, Friendliness","Python, Pandas, Google Colab",2Y2S,3.5,3,"Figma, Canva, Wireframing","Creativity, Highly Creative",Data Science & Analytics,77,3,2,5,1,1,6,4,9,7,2,9,Kinesthetic,,,,,,
Male,Anuradhapura,Maths Stream,"Public Speaking, Articulation, Conviction","React.js, Node.js, Express.js, MongoDB, Git, Docker",1Y2S,2.4,3.3,"Python, R, Scikit-learn, TensorFlow, Statistics;","Emotional Intelligence, Self-Awareness, Relationship Building;",IT / Technology Generalist,64,4,1,1,2,1,8,2,4,5,10,3,Kinesthetic,,,,,,
Male,Kegalle,Maths Stream,"Problem Solving, Always Right","C#, .NET Core, SQL Server, Git, Entity Framework",1Y2S,2.6,3.2,"Git, Docker Desktop, Basic Linux","Adaptability, Evolution, Progress;",AI / Machine Learning Engineer,56,4,3,2,3,4,10,1,6,4,4,5,Visual,,,,,,
Male,Anuradhapura,Commerce Stream,"Critical Thinking, Decision Making, Ethics","Node.js, Express.js, MongoDB, Postman",1Y1S,3.2,3.2,"TensorFlow, Keras, PyTorch, Docker, MLflow;","Problem Solving, Always Finds a Path",Cybersecurity / Network Engineer,98,5,2,4,1,5,6,1,6,10,8,2,Kinesthetic,,,,,,
Female,Kurunegala,Arts Stream,"Problem Solving, Infinite Solver","TryHackMe, Nmap, Kali Linux",2Y1S,4.9,3.2,"Java, MySQL, Git","Communication, Master Communicator",Data Science & Analytics,88,4,2,2,2,5,10,3,6,9,7,3,Kinesthetic,,,,,,
Female,Matara,Arts Stream,"Public Speaking, Influence, Motivation","Java, Git, VS Code, MySQL",1Y1S,4,3,"Node.js, Express.js, MongoDB, JWT, Git;","Creativity, Inventive Mind",Frontend / Web Developer,46,2,5,5,3,1,3,10,3,8,8,2,Visual,,,,,,
Male,Mannar,Bio Stream,"Presentation Skills, Hypnotic","Adobe XD, Figma, Framer, Design Thinking",2Y1S,3.5,3.3,"Java, Spring Boot, Microservices, Git, Docker;","Communication, Expression, Authenticity;",Data Science & Analytics,80,5,2,2,3,1,9,4,5,6,1,1,Kinesthetic,,,,,,
Other,Colombo,Bio Stream,"Presentation Skills, Confident Speaker","AWS S3, EC2",1Y2S,4,3.3,"Flutter, Dart, Firebase, Bloc, Push Notifications","Communication, Sonic Clarity",DevOps / Cloud Engineer,48,3,5,1,2,3,1,9,3,4,2,5,Kinesthetic,,,,,,
Male,Matara,Arts Stream,"Teamwork, One With All","Flutter, Dart, Firebase, Provider/Bloc/Riverpod, REST APIs, Git, State Management, App Publishing",4Y2S,1.8,3.3,"HTML, CSS, JavaScript, Bootstrap","Adaptability, Handles Anything",DevOps / Cloud Engineer,46,5,1,4,2,1,8,8,2,2,3,1,Aural,,,,,,
Male,Puttalam,Maths Stream,"Leadership, Forward Thinker","Java, Spring Boot, Kafka, PostgreSQL, JUnit",1Y1S,3.9,3.2,"React.js, Node.js, MongoDB, Express.js, Git","Time Management, Scheduling, Reliability;",Software Engineer / Backend,75,5,1,4,3,3,6,6,7,1,1,5,Visual,,,,,,
Male,Batticaloa,Commerce Stream,"Problem Solving, Analytical Mind, Precision","SQL, Power BI (Basic), Excel",1Y1S,4.2,3,"Kubernetes, Helm, GitLab CI, Prometheus, Bash;","Time Management, Prioritization, Multitasking",DevOps / Cloud Engineer,89,2,1,3,5,4,5,2,4,10,9,2,Visual,,,,,,
Male,Kalutara,Bio Stream,"Leadership, Commands Respect","Docker, Kubernetes, Jenkins, Terraform, AWS, Linux, Bash, CI/CD, Prometheus",1Y1S,4.4,3.3,"Java, Spring Boot, PostgreSQL, Docker, REST APIs;","Leadership, Born to Lead",UI/UX Designer,87,2,2,3,3,4,1,8,4,1,9,5,Aural,,,,,,
Female,Colombo,Arts Stream,"Leadership, Delegation, Conflict Management","Python, FastAPI, PostgreSQL, Docker, Git",1Y1S,4.9,3,"Kali Linux, Nmap, Python, Penetration Testing","Critical Thinking, Sharp Logic",Frontend / Web Developer,79,5,3,3,4,5,3,4,7,6,1,2,Kinesthetic,,,,,,
Male,Batticaloa,Bio Stream,"Problem Solving, Smart Troubleshooter","Figma, Canva, Basic UI/UX, Prototyping",1Y1S,2.9,3,"HTML, CSS, React.js, Node.js, Express.js","Leadership, Transformation, Impact;",IT / Technology Generalist,88,1,2,1,4,1,9,1,3,4,4,6,Kinesthetic,,,,,,
Female,Colombo,Arts Stream,"Teamwork, Cooperation, Loyalty","TensorFlow, PyTorch, Scikit-learn, FastAPI",2Y2S,4,3.2,"React.js, TypeScript, Redux Toolkit, Tailwind CSS, Git;","Emotional Intelligence, Emotionally Aware",Data Science & Analytics,41,1,3,1,5,2,5,2,9,10,8,4,Visual,,,,,,
Male,Nuwara Eliya,Maths Stream,"Public Speaking, Charisma, Presence","Node.js, Express.js, MongoDB, JWT, Docker",1Y1S,2,3.3,"Flutter, Dart, Firebase, Bloc, Push Notifications","Leadership, Vision Driver",Frontend / Web Developer,66,3,4,5,3,1,2,4,5,3,3,3,Read/Write,,,,,,
Male,Gampaha,Arts Stream,"Leadership, Conflict Resolution, Negotiation","SQL, Python, Power BI, Tableau, Statistics",2Y1S,2.2,2.8,"TensorFlow, Keras, PyTorch, Docker, MLflow;","Presentation Skills, Smooth Delivery",DevOps / Cloud Engineer,74,2,1,3,5,2,9,4,4,5,8,2,Kinesthetic,,,,,,
Male,Jaffna,Commerce Stream,"Leadership, Strong Presence","Docker, Kubernetes, Jenkins, Terraform, CI/CD",2Y1S,4,3.3,"Python, Jupyter, Pandas","Teamwork, Unites People",Data Science & Analytics,92,1,4,5,4,3,8,8,1,2,7,3,Kinesthetic,,,,,,
Female,Anuradhapura,Maths Stream,"Leadership, Delegation, Conflict Management","Java, Spring Boot, Kafka, PostgreSQL, Docker",2Y2S,4.9,3.2,"Kali Linux, Nmap, TryHackMe","Teamwork, Strong Support System",AI / Machine Learning Engineer,98,4,2,1,3,2,9,6,9,10,3,2,Visual,,,,,,
Female,Kurunegala,Arts Stream,"Critical Thinking, Strong Reasoner","PyTorch, TensorFlow, Scikit-learn, MLflow",2Y1S,2.2,3.3,"MERN Stack, Redux, Docker, Git, Firebase;","Adaptability, Resilience, Positive Attitude;",Software Engineer / Backend,90,3,3,4,1,1,6,4,7,7,7,6,Read/Write,,,,,,
Female,Batticaloa,Maths Stream,"Critical Thinking, Strong Analyst","Node.js, Express.js, MongoDB",2Y1S,4.2,3.3,"Java, Python, Spring Boot, Git, MySQL;","Teamwork, Powerful Unity",DevOps / Cloud Engineer,52,1,4,5,5,3,2,2,8,4,4,2,Aural,,,,,,
Female,Mullaitivu,Maths Stream,"Leadership, Accountability, Ownership","Kali Linux, Wireshark, Nmap, Burp Suite, Python Scripting, Ethical Hacking, OWASP Top 10",1Y1S,3.2,3.2,"PyTorch, TensorFlow, Docker, MLflow, AWS SageMaker;","Teamwork, Legendary",IT / Technology Generalist,74,3,1,3,1,4,10,4,1,5,3,4,Read/Write,,,,,,
Female,Anuradhapura,Maths Stream,"Presentation Skills, Outstanding","SQL, Python, Power BI, Tableau, Statistics",1Y2S,3.7,3.3,"SQL, Python, Power BI, Tableau, Statistics","Emotional Intelligence, Socially Aware",Mobile App Developer,67,4,2,2,3,1,10,1,10,2,2,4,Kinesthetic,,,,,,
Male,Kalutara,Arts Stream,"Teamwork, Positive Collaborator","Python, Pandas, Excel",1Y2S,2,3.2,"AWS, CloudFormation, VPC, IAM, Security Groups","Emotional Intelligence, Grounded & Aware",UI/UX Designer,81,3,1,3,4,2,5,7,4,4,5,2,Visual,,,,,,
Female,Batticaloa,Commerce Stream,"Communication, Clarity, Sincerity","React.js, Node.js, MongoDB, Express.js, Redux",1Y2S,3.2,3.2,"Java, Spring Boot, Git, MySQL, Docker;","Creativity, Inventive Mind",DevOps / Cloud Engineer,78,4,1,4,2,1,10,7,2,5,6,9,Kinesthetic,,,,,,
Male,Ampara,Maths Stream,"Problem Solving, Logic, Reasoning","Docker, Kubernetes, Jenkins, Bash, Terraform",2Y1S,3.5,3.3,"AWS Free Tier, S3, EC2, IAM Basics, AWS Console","Emotional Intelligence, Understanding, Kindness;",AI / Machine Learning Engineer,83,2,5,4,4,2,4,3,10,2,9,4,Aural,,,,,,
Female,Puttalam,Bio Stream,"Leadership, Emerging Leader","Flutter, Dart, Android Studio",2Y1S,1.1,2.8,"Java, Spring Boot, Hibernate, PostgreSQL, Maven","Leadership, Vision Driver",DevOps / Cloud Engineer,54,5,1,1,5,5,5,8,8,9,2,5,Aural,,,,,,
Female,Gampaha,Commerce Stream,"Communication, Pure Love","Figma, Prototyping, User Research, WCAG",2Y2S,4.9,3.2,"PyTorch, TensorFlow, Scikit-learn, FastAPI, Docker;","Time Management, Deadline-Oriented, Discipline;",Data Science & Analytics,75,1,1,1,2,4,6,3,8,5,3,6,Read/Write,,,,,,
Male,Jaffna,Maths Stream,"Critical Thinking, Evaluation, Judgment","Python, Django, PostgreSQL, Git, Redis",1Y2S,2.1,3.3,"Figma, Wireframing","Emotional Intelligence, Grounded & Aware",DevOps / Cloud Engineer,49,3,5,2,4,3,2,8,8,4,10,1,Kinesthetic,,,,,,
Female,Kalutara,Bio Stream,"Presentation Skills, Graceful Presenter","Figma, Canva, Basic Wireframing, Prototyping, Color Theory, Free Icons",2Y1S,1.9,3.3,"PyTorch, TensorFlow, Scikit-learn, Docker, FastAPI;","Creativity, Originality, Artistry;",DevOps / Cloud Engineer,52,4,5,5,1,4,1,8,9,9,4,8,Visual,,,,,,
Male,Vavuniya,Maths Stream,"Time Management, Universal Timer","Wireshark, Kali Linux, Python, Ethical Hacking",1Y2S,2.2,3,"Figma, Canva, Wireframing","Creativity, Brainstorming, Originality;",Mobile App Developer,54,4,2,2,3,4,1,4,6,10,5,7,Visual,,,,,,
Female,Jaffna,Bio Stream,"Communication, Clarity, Confidence","React.js, Node.js, MongoDB, Express.js, TypeScript, Docker",2Y2S,1.5,3.2,"Python, Google Colab, Jupyter Notebook, Pandas, Matplotlib","Leadership, Encouraging Mentor",DevOps / Cloud Engineer,54,2,5,3,2,2,9,1,4,5,2,6,Visual,,,,,,
Male,Anuradhapura,Bio Stream,"Time Management, Efficiency, Focus","Python, Google Colab, Scikit-learn",2Y2S,2,3.2,"Angular, TypeScript, RxJS, NgRx, SCSS;","Communication, Negotiation, Persuasion;",DevOps / Cloud Engineer,91,3,4,4,5,1,10,3,3,10,6,5,Visual,,,,,,
Male,Gampaha,Bio Stream,"Problem Solving, Troubleshooting, Ingenuity","React.js, Node.js, MongoDB, Express.js, Git",1Y2S,4.4,3,"Python Scripting, Metasploit, Nmap, Burp Suite, SIEM;","Time Management, Discipline, Reliability;",Software Engineer / Backend,60,5,3,5,5,4,4,7,9,1,4,4,Kinesthetic,,,,,,
Female,Vavuniya,Bio Stream,"Leadership, Emerging Leader","SQL, Excel, Power BI (Basic), Google Sheets",1Y2S,3,3.2,"Python, R, XGBoost, Feature Engineering, SQL","Problem Solving, Tactical Mind",IT / Technology Generalist,77,1,3,2,5,4,4,10,8,3,6,7,Kinesthetic,,,,,,
Female,Puttalam,Bio Stream,"Teamwork, Great Collaborator","MERN Stack, Redux, Docker, Git, Firebase",2Y1S,2.9,3.2,"Vue.js, Node.js, Express.js, MongoDB, Vuetify.","Communication, Presentation Skills, Emotional Intelligence",UI/UX Designer,71,5,4,3,5,2,4,8,2,5,1,4,Mixed (Visual + Kinesthetic),,,,,,
Male,Galle,Arts Stream,"Time Management, Steady Workflow","Java, VS Code",2Y1S,3.7,2.8,"Node.js, Express.js, MongoDB, Mongoose, JWT;","Public Speaking, Stage Dominator",UI/UX Designer,67,1,5,3,1,5,9,10,6,6,6,8,Kinesthetic,,,,,,
Female,Kalutara,Maths Stream,"Presentation Skills, Storytelling, Charisma","Java, Spring Boot, Microservices, Git, Docker",2Y2S,1.8,3.3,"MERN Stack, Redux, Docker, Git, Firebase;","Leadership, Encouraging Mentor",Frontend / Web Developer,45,2,4,3,5,4,3,7,5,1,5,9,Visual,,,,,,
Female,Kalutara,Bio Stream,"Teamwork, Collaboration, Reliability","Node.js, NestJS, TypeScript, PostgreSQL, GraphQL, Docker",1Y2S,1.9,3,"HTML5, CSS3, JavaScript, React.js, Git;","Problem Solving, Breaks Every Code",Data Science & Analytics,99,1,1,2,1,4,8,7,10,3,3,10,Visual,,,,,,
Female,Kilinochchi,Bio Stream,"Critical Thinking, Research Skills, Objectivity","TensorFlow, PyTorch, MLflow, Docker, AWS",1Y2S,4,3.2,"Git, Docker Desktop","Teamwork, Supportive Ally",Data Science & Analytics,63,5,3,2,3,1,2,9,10,4,3,10,Kinesthetic,,,,,,
Other,Galle,Bio Stream,"Critical Thinking, 9000 IQ","Java, Spring Boot, Hibernate, PostgreSQL, REST, Maven",2Y1S,4.9,3.2,"HTML, CSS, React.js, Node.js","Public Speaking, Engaging Voice",DevOps / Cloud Engineer,84,1,2,1,3,1,7,5,1,4,2,4,Visual,,,,,,
Male,Ratnapura,Arts Stream,"Problem Solving, World Changing, Revolutionary","Java, Spring Boot, Microservices, Docker, Maven",1Y2S,2.4,3,"Java, Python, Spring Boot, Git, Docker","Emotional Intelligence, Awareness, Control;",Data Science & Analytics,49,2,2,1,5,4,10,3,6,4,6,3,Visual,,,,,,
Male,Gampaha,Maths Stream,"Problem Solving, Strategic Thinking, Foresight","HTML, CSS, React.js",1Y2S,1,3.3,"Figma, Canva, Prototyping","Emotional Intelligence, Empathy, Social Skills;",Mobile App Developer,73,4,2,2,1,3,7,9,7,10,7,10,Kinesthetic,,,,,,
Male,Kurunegala,Bio Stream,"Leadership, Inspiring Guide","Node.js, Express.js, MongoDB, Mongoose, JWT, Docker, Git",2Y1S,1.8,3,"Figma, Prototyping, User Testing, Design Thinking;","Time Management, Always On Track",DevOps / Cloud Engineer,64,3,2,1,2,1,9,7,9,8,5,6,Mixed (Visual + Kinesthetic),,,,,,
Female,Matale,Maths Stream,"Emotional Intelligence, Compassion Engine","Python, Scikit-learn, Pandas, XGBoost, Feature Engineering",1Y2S,3.5,3.2,"Python, Google Colab, Pandas, Matplotlib","Adaptability, Flexibility, Learning Agility",Mobile App Developer,73,5,4,4,3,5,3,2,4,2,4,7,Mixed (Read/Write + Kinesthetic),,,,,,
Male,Nuwara Eliya,Bio Stream,"Leadership, Motivational","Python, Google Colab, Jupyter Notebook, Pandas, Matplotlib",1Y2S,2.7,3.2,"Python, Google Colab","Leadership, Empowerment, Growth;",Data Science & Analytics,92,5,1,5,5,2,1,10,5,1,9,8,Read/Write,,,,,,
Male,Ratnapura,Commerce Stream,"Emotional Intelligence, Soul Reader","Figma, User Flows, Prototyping, Accessibility, A/B Testing",1Y2S,3.7,2.8,"Python, Scikit-learn, XGBoost, SQL, Model Deployment","Emotional Intelligence, Emotionally Aware",Frontend / Web Developer,82,4,3,1,2,2,10,8,7,10,1,5,Read/Write,,,,,,
Female,Kegalle,Bio Stream,"Time Management, Perfect","Figma, Wireframing, Prototyping, User Flows, A/B Testing",1Y1S,1.1,3.2,"Node.js, Express.js, MongoDB","Critical Thinking, Genius",Mobile App Developer,85,3,4,5,5,4,8,8,5,10,7,8,Kinesthetic,,,,,,
Female,Badulla,Arts Stream,"Teamwork, Collaboration, Empathy","Java, VS Code, Git, MySQL",2Y2S,1.9,3.3,"Wireshark, Nmap, Burp Suite, Python, Vulnerability Assessment","Problem Solving, Calm Problem Breaker",DevOps / Cloud Engineer,96,4,2,5,2,1,7,3,1,1,4,1,Visual,,,,,,
Male,Mannar,Maths Stream,"Communication, Pure Love","Python, Google Colab",3Y1S,4,3.2,"HTML, CSS, React.js, Node.js","Critical Thinking, Insight, Brilliance;",Data Science & Analytics,54,3,5,3,3,5,4,7,6,2,9,2,Aural,,,,,,
Female,Jaffna,Commerce Stream,"Problem Solving, Strategy, Insight","Python, Google Colab",1Y1S,3.4,3.3,"TensorFlow, Keras, PyTorch, OpenCV, NLP","Leadership, Transformation, Impact;",Mobile App Developer,83,1,2,1,1,3,1,9,4,3,3,6,Visual,,,,,,
Male,Batticaloa,Commerce Stream,"Emotional Intelligence, Awareness, Control","SQL, Python (Pandas), Tableau, Power BI, Data Warehousing, Statistics, Looker Basics",1Y1S,1.5,3,"TensorFlow, Keras, PyTorch, Docker, FastAPI;","Time Management, Precision Timing",DevOps / Cloud Engineer,90,4,2,5,2,1,3,2,10,9,5,3,Visual,,,,,,
Other,Badulla,Maths Stream,"Communication, Emotional Intelligence, Networking","Figma, Canva",1Y2S,4.5,3.2,"SQL, Excel, Power BI (Basic), Google Sheets","Communication, Divine Connection",Data Science & Analytics,62,1,4,1,5,2,5,4,4,7,4,5,Kinesthetic,,,,,,
Male,Nuwara Eliya,Maths Stream,"Teamwork, Unity, Camaraderie","Python, Pandas",2Y2S,4.4,3.2,"Java, VS Code, Git, MySQL","Time Management, Scheduling, Reliability;",Mobile App Developer,88,2,4,1,2,3,2,4,8,4,8,5,Visual,,,,,,
Female,Trincomalee,Arts Stream,"Leadership, Inspires Others","TensorFlow, PyTorch, OpenCV, NLP (Transformers), Docker, FastAPI, MLflow",2Y1S,3.4,3.2,"Flutter, Dart","Teamwork, Planet-Level Cooperation",Data Science & Analytics,76,2,4,3,1,4,6,4,5,10,10,10,Visual,,,,,,
Male,Kandy,Commerce Stream,"Problem Solving, Logic, Reasoning","HTML, CSS, React.js, Node.js",1Y2S,2,3.3,"Kubernetes, Helm, Prometheus, GitOps, Bash","Time Management, Planning, Goal Setting;",DevOps / Cloud Engineer,99,1,2,2,2,3,5,4,5,3,5,9,Visual,,,,,,
Male,Mannar,Commerce Stream,"Teamwork, Positive Collaborator","HTML, CSS, JavaScript, React.js, Bootstrap, Git",2Y2S,2.6,3.2,"HTML, CSS, React.js, Node.js, Express.js","Public Speaking, Engaging Speaker",Frontend / Web Developer,73,3,3,4,2,3,9,1,5,1,9,9,Read/Write,,,,,,
