Gender,District_Location,Education_Stream,Soft_Skills,Key_Skils,Current_semester,GPA,Experties_Preferred_GPA,Experties_preferred_tech_skills,Experties_preferred_Skills,Experties_Preferred_Career_Field,English_score,Ocean_Openness,Ocean_Conscientiousness,Ocean_Extraversion,Ocean_Agreeableness,Ocean_Neuroticism,Riasec_Realistic,Riasec_Investigative,Riasec_Artistic,Riasec_Social,Riasec_Enterprising,Riasec_Conventional,Learning_Style,Course_Recommendation,University_Recommendation,Skill_Gap_Score,Feedback_Score,Data_Consent,Timestamp
Male,Galle,Bio Stream,"Problem Solving, Analytical Thinking, Creativity","Python, Scikit-learn, Pandas, XGBoost, Hyperparameter Tuning, Jupyter, SQL",1Y2S,2.7,2.8,"Docker, Kubernetes, Jenkins, Terraform, AWS","Adaptability, Transformative Thinker",Data Science & Analytics,66,3,5,1,1,4,2,8,6,5,5,5,Read/Write,,,,,,
Other,Trincomalee,Commerce Stream,"Emotional Intelligence, Self-Aware","Java, Spring Boot, MySQL, Git, REST APIs",2Y1S,3,3.2,"Python, Pandas","Public Speaking, Eloquence, Mastery;",UI/UX Designer,83,5,5,5,1,1,2,2,6,9,10,6,Read/Write,,,,,,
Male,Vavuniya,Arts Stream,"Presentation Skills, Elite Speaker","Python, Flask, PostgreSQL, Git, Redis",1Y1S,2.4,3.3,"Python, Scikit-learn, Pandas, Jupyter, SQL;","Emotional Intelligence, Exceptional",Mobile App Developer,47,1,5,5,1,3,7,3,8,6,1,1,Visual,,,,,,
Other,Mullaitivu,Maths Stream,"Leadership, Natural Force","Figma, Canva, Prototyping",1Y1S,4.4,3.3,"React.js, Node.js, Express.js, MongoDB, Redux;","Communication, Warm Connector",UI/UX Designer,87,1,3,3,4,3,4,4,6,9,5,9,Visual,,,,,,
Male,Kalutara,Bio Stream,"Teamwork, Collaboration, Unity","Python, Pandas",1Y2S,1,3.3,"Flutter, Dart, Firebase, Provider, REST APIs;","Leadership, Inspiring Guide",Data Science & Analytics,75,3,3,2,4,5,1,1,8,9,7,1,Visual,,,,,,
Other,Gampaha,Arts Stream,"Public Speaking, Inspires Crowds","C#, .NET Core, SQL Server, Git, Entity Framework",1Y1S,4.8,3.2,"AWS Free Tier, S3","Presentation Skills, Elite Speaker",DevOps / Cloud Engineer,54,1,4,1,1,5,1,5,5,3,8,10,Kinesthetic,,,,,,
Male,Anuradhapura,Maths Stream,"Creativity, Creates Worlds","Python, Google Colab, Jupyter Notebook, Pandas, Matplotlib",1Y2S,2.4,3,"Kali Linux, Nmap, Python, Penetration Testing","Teamwork, Coordination, Harmony;",DevOps / Cloud Engineer,59,1,2,3,4,1,9,1,10,8,2,10,Kinesthetic,,,,,,
Female,Jaffna,Maths Stream,"Creativity, Innovation, Boldness","Kali Linux Basics, Nmap, Wireshark, TryHackMe, Burp Suite Community",2Y1S,1.5,3,"Python, Pandas, Google Colab","Creativity, Unique Perspective",AI / Machine Learning Engineer,38,3,2,2,1,4,6,1,4,5,3,7,Visual,,,,,,
Other,Puttalam,Technology Stream,"Problem Solving, Logic, Reasoning","Python, Flask, PostgreSQL, Git, Redis",3Y2S,3.4,3,"Adobe XD, Figma, Framer, Interaction Design;","Communication, Divine Connection",DevOps / Cloud Engineer,50,1,4,3,4,5,4,4,3,3,10,8,Aural,,,,,,
Male,Jaffna,Technology Stream,"Problem Solving, Decision Making, Logic","MERN Stack, Docker, Git, Redux, MongoDB, Express",1Y2S,2.1,3.3," React.js, Node.js, Express.js, MongoDB, TypeScript","Critical Thinking, Sharp Mind",Data Science & Analytics,99,5,4,5,3,5,2,4,9,1,5,4,Aural,,,,,,
Female,Gampaha,Bio Stream,"Problem Solving, Strategic Thinker","Docker Desktop, Git, Basic Commands",1Y1S,1.8,3.3,"Flutter, Dart, Firebase","Adaptability, Flexibility, Agility;",Frontend / Web Developer,58,2,3,4,2,2,2,9,10,6,8,4,Kinesthetic,,,,,,
Female,Kilinochchi,Bio Stream,"Leadership, Emerging Leader","TensorFlow, PyTorch, MLflow, Docker, AWS",3Y1S,1.1,3,"Wireshark, Kali Linux, Python, Ethical Hacking, Nmap;","Time Management, Efficiency, Discipline;",Frontend / Web Developer,93,3,3,2,2,3,10,10,3,3,9,7,Kinesthetic,,,,,,
Male,Vavuniya,Commerce Stream,"Critical Thinking, Sharp & Fair","Adobe XD, Figma, Framer, Design Thinking, Prototyping",1Y2S,4.9,3.3,"React.js, Node.js, Express.js, MongoDB, Redux ","Public Speaking, Powerful Presence",DevOps / Cloud Engineer,69,5,1,4,1,4,2,3,5,10,10,10,Read/Write,,,,,,
Male,Trincomalee,Commerce Stream,"Teamwork, Supportive Ally","Python, Django, Git, PostgreSQL, Celery",2Y2S,2.9,3,"Python Scripting, Metasploit, Nmap, Burp Suite, SIEM;","Leadership, Natural Leader",AI / Machine Learning Engineer,59,4,4,1,5,1,2,8,3,1,8,3,Read/Write,,,,,,
Male,Kalutara,Commerce Stream,"Leadership, Galaxy-Level Influence","MERN Stack, Docker, Git, Redux, Postman",2Y2S,2.7,3,"AWS EC2, S3, Lambda, VPC, IAM","Communication, Warm Connector",DevOps / Cloud Engineer,58,4,2,4,1,3,4,4,1,8,3,3,Visual,,,,,,
Male,Kegalle,Bio Stream,"Time Management, Beyond Time","Docker, Kubernetes, Jenkins, Terraform, CI/CD",2Y1S,1,3.2,"Docker Desktop, Git","Teamwork, Harmony Builder",Data Science & Analytics,58,5,4,3,4,1,1,3,6,8,8,3,Visual,,,,,,
Male,Galle,Maths Stream,"Leadership, Emerging Leader","SQL, Python, Tableau, Power BI, Data Visualization",2Y1S,4.5,3.2,"SQL, Python (Pandas), Tableau, Power BI, Data Warehousing;","Teamwork, Unites People",Cybersecurity / Network Engineer,66,3,5,2,4,4,6,8,8,10,7,8,Visual,,,,,,
Male,Puttalam,Commerce Stream,"Problem Solving, Analytical Mind, Precision","HTML, CSS, React.js",2Y2S,2.9,3.2,"AWS EC2, VPC, IAM, CloudWatch, Route53","Time Management, Focus, Consistency;",AI / Machine Learning Engineer,74,1,4,1,2,4,9,2,1,8,3,8,Visual,,,,,,
Female,Monaragala,Bio Stream,"Problem Solving, Analysis, Solutions","Java, Spring Boot, Microservices, Docker, Git",1Y2S,4.2,3,"HTML, CSS, React.js, Node.js, Express.js","Critical Thinking, Evaluation, Wisdom;",UI/UX Designer,69,4,2,2,2,5,3,7,9,5,2,3,Read/Write,,,,,,
Female,Batticaloa,Arts Stream,"Problem Solving, Solution-Oriented, Persistence","Java, Spring Boot, Microservices, Docker, Git",2Y2S,1.1,3,"HTML, CSS, JavaScript","Time Management, Organization, Orderliness;",Data Science & Analytics,47,3,3,1,2,1,2,9,7,8,2,8,Visual,,,,,,
Female,Puttalam,Maths Stream,"Adaptability, Handles Pressure Well","TensorFlow, PyTorch, OpenCV, NLP, Docker, FastAPI",2Y2S,1.3,3,"Java, Spring Boot, PostgreSQL, Docker, REST APIs;","Time Management, Perfect Balance",AI / Machine Learning Engineer,72,1,3,2,3,4,9,9,2,8,9,6,Aural,,,,,,
Male,Ampara,Bio Stream,"Leadership, Born Leader","HTML, CSS, React.js, Node.js, MongoDB",1Y2S,3.7,3.2,"Python, Google Colab","Public Speaking, Eloquence, Mastery;",Frontend / Web Developer,100,4,1,1,4,1,9,2,10,10,2,5,Aural,,,,,,
Female,Vavuniya,Bio Stream,"Emotional Intelligence, Self-Aware","Flutter, Dart",1Y1S,1.5,3.2,"SQL, Pandas, Power BI, Tableau, Statistics;","Presentation Skills, Outstanding",Data Science & Analytics,77,2,2,1,2,5,9,6,3,8,3,5,Visual,,,,,,
Male,Colombo,Arts Stream,"Leadership, Strategic Thinking, Mentoring","Figma, Prototyping",1Y2S,2.9,3,"MERN Stack, Redux, Docker, Firebase, Git","Creativity, Vision, Imagination;",Mobile App Developer,57,5,3,1,2,2,3,3,3,7,1,10,Mixed (Visual + Read/Write),,,,,,
Male,Kegalle,Commerce Stream,"Time Management, Planning, Achievement","Python, Jupyter",2Y1S,2.6,3.2,"Wireshark, Kali Linux, Python, Ethical Hacking, Nmap;","Problem Solving, Innovation, Future;",Data Science & Analytics,67,4,5,5,4,5,10,3,8,10,4,2,Kinesthetic,,,,,,
Female,Mannar,Bio Stream,"Communication, Warm Professionalism","Java, Spring Boot, Microservices, Docker, Git",1Y2S,1.1,3.2,"Flutter, Dart, Firebase, Provider, REST APIs;","Time Management, Always Meets Deadlines",Data Science & Analytics,70,1,4,3,3,1,6,6,2,4,4,10,Visual,,,,,,
Male,Polonnaruwa,Technology Stream,"Emotional Intelligence, Self-Aware","Flutter, Dart, Firebase Auth, GetX/Bloc, Push Notifications, Google Maps, In-app Purchase",1Y1S,2.4,3.3,"SQL, Excel, Power BI (Basic)","Communication, Crystal Clear Voice",Frontend / Web Developer,93,4,4,1,3,5,4,7,8,6,9,7,Kinesthetic,,,,,,
Female,Mannar,Bio Stream,"Leadership, Motivator","HTML, CSS, React.js, Node.js",2Y2S,1.1,3.2,"Figma, Canva, Wireframing, Basic Prototyping","Critical Thinking, Sharp Mind",AI / Machine Learning Engineer,82,1,4,5,5,4,8,7,8,2,2,6,Visual,,,,,,
Other,Gampaha,Bio Stream,"Critical Thinking, Research Skills, Objectivity","Docker, Kubernetes, Jenkins, Terraform, Bash",1Y2S,2,3,"Python, Scikit-learn, Pandas, Model Evaluation, SQL;","Problem Solving, Infinite Solver",AI / Machine Learning Engineer,66,5,3,2,3,4,4,3,7,5,7,2,Mixed (Visual + Kinesthetic),,,,,,
Female,Polonnaruwa,Bio Stream,"Emotional Intelligence, Cosmic Empathy",AWS Free Tier,2Y2S,1.8,3.2,"Kali Linux, Wireshark, Nmap, Python, Ethical Hacking;","Leadership, Strong Potential",IT / Technology Generalist,80,5,1,4,4,3,7,4,2,10,4,5,Visual,,,,,,
Male,Mannar,Maths Stream,"Problem Solving, Persistence, Tenacity","Flutter, Dart, Firebase, Provider, REST APIs, Git, Material Design",2Y2S,2.6,3.2,"Python, Jupyte","Communication, Connection, Rapport;",Software Engineer / Backend,87,5,4,3,3,4,5,10,6,7,7,8,Visual,,,,,,
Male,Matara,Bio Stream,"Leadership, Emerging Leader","Docker Desktop, Git",2Y2S,2.1,3,"AWS EC2, Lambda, S3, CloudFront, Route53;","Communication, Confidence, Warmth;",Software Engineer / Backend,49,2,3,1,5,3,6,9,1,4,7,9,Kinesthetic,,,,,,
Female,Mannar,Maths Stream,"Teamwork, Trusted Collaborator","Java, Spring Boot, Hibernate, REST APIs, Maven",1Y1S,3.5,3,"Python, Excel, Matplotlib","Communication, Confidence, Warmth;",UI/UX Designer,41,4,2,5,4,5,2,6,2,7,9,4,Read/Write,,,,,,
Male,Kurunegala,Arts Stream,"Problem Solving, Resourcefulness, Proactivity","Node.js, NestJS, TypeScript, GraphQL, Prisma",1Y1S,4.8,3.2,"Java, VS Code, MySQL, Git","Communication, Friendly & Skilled",Data Science & Analytics,80,2,1,4,3,4,7,3,4,3,8,6,Kinesthetic,,,,,,
Female,Batticaloa,Arts Stream,"Leadership, Born Leader","PyTorch, OpenCV, TensorFlow, Docker, FastAPI",1Y2S,3.2,3.3,"Python, Google Colab, Scikit-learn, Pandas, Jupyter","Emotional Intelligence, Soul Reader",Frontend / Web Developer,56,3,4,4,5,1,3,6,8,8,4,3,Kinesthetic,,,,,,
Male,Galle,Commerce Stream,"Communication, Warm Communicator","Flutter, Dart, Firebase, Riverpod, App Publishing",1Y2S,4.2,3.3,"Git, Docker Desktop","Problem Solving, Resilience, Determination;",Data Science & Analytics,100,5,4,2,3,3,8,2,6,1,8,9,Visual,,,,,,
Female,Kilinochchi,Technology Stream,"Time Management, Laser Focused","Java, Python, Spring Boot, MySQL, Git, REST APIs",2Y2S,4.8,3,"Node.js, NestJS, TypeScript, PostgreSQL, GraphQL;","Public Speaking, Influence, Motivation.",Data Science & Analytics,95,4,3,3,3,1,7,8,1,9,5,4,Visual,,,,,,
Female,Hambantota,Bio Stream,"Creativity, Inventive Mind","SQL, Tableau, Power BI, Python, Statistics, Data Visualization",1Y1S,2.2,3,"SQL, Excel, Power BI (Basic), Google Sheets, Pandas","Communication, Confident & Clear",DevOps / Cloud Engineer,74,1,3,1,4,2,7,10,4,4,6,3,Kinesthetic,,,,,,
Other,Puttalam,Commerce Stream,"Communication, Warm Communicator","Python, Google Colab",1Y2S,3.2,3,"SQL, Power BI, Python, Statistics, Tableau","Communication, Emotional Intelligence, Networking",Data Science & Analytics,88,5,2,1,2,4,9,8,9,4,7,2,Visual,,,,,,
Male,Batticaloa,Bio Stream,"Critical Thinking, 9000 IQ","React.js, Redux, JavaScript, Git, Bootstrap",2Y2S,4.4,3,"Python, Pandas, Excel, Matplotlib","Critical Thinking, Reasoning, Insight;",Frontend / Web Developer,55,3,1,4,1,4,8,2,9,4,10,9,Visual,,,,,,
Female,Ratnapura,Bio Stream,"Time Management, Always Prepared","Python, Pandas, Google Colab",2Y1S,2.7,3,"Flutter, Dart, Firebase, Riverpod, REST APIs;","Emotional Intelligence, Heart of Gold",Data Science & Analytics,77,2,5,4,3,5,7,1,7,5,3,10,Aural,,,,,,
Female,Mullaitivu,Technology Stream,"Adaptability, Very Flexible","Python, Flask, PostgreSQL, Git, Redis",2Y1S,1.9,3,"HTML, CSS, JavaScript, React.js","Presentation Skills, Outstanding",Data Science & Analytics,47,4,2,2,5,2,8,5,4,8,2,1,Visual,,,,,,
Female,Jaffna,Technology Stream,"Emotional Intelligence, Highly Aware","Flutter, Dart, Android Studio, Firebase Auth, VS Code",1Y1S,1.1,3,"Python, Excel, Matplotlib","Emotional Intelligence, Grounded & Aware",UI/UX Designer,86,3,1,1,5,3,2,6,1,3,5,9,Kinesthetic,,,,,,
Female,Puttalam,Maths Stream,"Communication, Warm Professionalism","SQL, Python, Tableau, Power BI, Data Visualization",2Y1S,4.4,3.2,"Docker, Kubernetes, Jenkins, Bash, Terraform","Problem Solving, Rapid Resolution",Data Science & Analytics,79,5,2,5,4,4,6,7,5,4,1,3,Aural,,,,,,
Other,Kurunegala,Maths Stream,"Time Management, Perfect Planning","Python, Pandas",2Y1S,2.7,3.2,"SQL, Pandas, Power BI, Excel Advanced, Statistics","Teamwork, Universal Connector",Data Science & Analytics,38,5,4,3,2,5,3,3,9,4,3,2,Kinesthetic,,,,,,
Female,Matara,Maths Stream,"Adaptability, Transformative Thinker","Java, Spring Boot, Kafka, PostgreSQL, JUnit",1Y1S,3.7,3.3,"Python, R, Scikit-learn, Feature Engineering","Time Management, Disciplined",DevOps / Cloud Engineer,56,1,4,1,5,3,3,6,3,10,1,9,Visual,,,,,,
Male,Kurunegala,Bio Stream,"Leadership, Natural Leader","Wireshark, Nmap, Python, Ethical Hacking",2Y2S,3.7,3.2,"Adobe XD, Figma, Framer, User Research","Leadership, Visionary Thinking, Strategy;",Data Science & Analytics,56,3,5,5,4,4,8,10,6,8,5,7,Kinesthetic,,,,,,
Male,Monaragala,Bio Stream,"Teamwork, Team Accelerator","Python, Pandas, Excel, Matplotlib",1Y1S,2.6,3,"Flutter, Dart, Firebase, Provider/Bloc/Riverpod, REST APIs","Critical Thinking, Sharp Logic",DevOps / Cloud Engineer,85,5,3,4,4,1,9,5,3,10,4,6,Read/Write,,,,,,
Female,Anuradhapura,Maths Stream,"Emotional Intelligence, Nirvana, Bliss","PyTorch, TensorFlow, Docker, MLflow, AWS SageMaker",1Y1S,3,3.2,"Kali Linux, Nmap, Python, Penetration Testing","Teamwork, Excellent Team Member",DevOps / Cloud Engineer,81,1,3,4,1,3,2,7,1,10,10,9,Kinesthetic,,,,,,
Male,Galle,Commerce Stream,"Creativity, Modern Thinker","Java, Python, Spring Boot, Git, Docker",1Y2S,2.9,3.3,"Figma, Adobe XD, User Testing, Accessibility","Emotional Intelligence, Soul Reader",AI / Machine Learning Engineer,75,5,3,5,4,4,1,7,7,5,8,1,Visual,,,,,,
Female,Nuwara Eliya,Commerce Stream,"Problem Solving, Analytical Mind, Precision","AWS Free Tier, EC2, S3",1Y1S,1.1,3.3,"Docker Desktop, Git, Basic Commands","Leadership, Responsibility, Integrity;",DevOps / Cloud Engineer,75,1,1,2,5,2,6,8,3,9,10,1,Visual,,,,,,
Male,Vavuniya,Maths Stream,"Adaptability, Flexibility, Agility","Java, Spring Boot, Git, MySQL, Docker",1Y2S,2,3.3,"Python, Pandas","Time Management, Mastery, Excellence;",UI/UX Designer,77,5,3,1,4,1,10,9,2,3,3,8,Kinesthetic,,,,,,
Male,Ampara,Commerce Stream,"Problem Solving, Practical Solutions","Python, Google Colab, Pandas, Matplotlib",1Y1S,4,3.2,"Kali Linux, Wireshark, Nmap, Python, Ethical Hacking;","Public Speaking, Confidence, Stage Presence;",Data Science & Analytics,67,2,2,2,4,5,6,5,10,7,3,8,Visual,,,,,,
Male,Kalutara,Arts Stream,"Creativity, Innovation, Risk-Taking","Kubernetes, Docker, Terraform, AWS EKS, Prometheus, Grafana, ArgoCD, GitOps",2Y1S,1,3.2,"SQL, Python (Pandas), Tableau, Power BI, Data Warehousing;","Time Management, Planning, Achievement;",DevOps / Cloud Engineer,76,5,1,2,4,1,4,10,10,7,6,2,Kinesthetic,,,,,,
Female,Anuradhapura,Commerce Stream,"Emotional Intelligence, Self-Regulation, Motivation","Adobe XD, Figma, Framer, Interaction Design",1Y2S,2.9,3,"HTML, CSS, React.js, Node.js, Express.js","Problem Solving, Logical Reasoning, Patience",DevOps / Cloud Engineer,81,2,5,1,1,5,2,3,2,3,6,2,Visual,,,,,,
Female,Batticaloa,Commerce Stream,"Creativity, Universe Builder","React.js, Node.js, Express.js",1Y1S,2,3.2,"Docker Desktop, Git","Problem Solving, Solution-Oriented, Persistence;",Frontend / Web Developer,61,5,2,3,4,1,4,10,9,1,1,9,Visual,,,,,,
Female,Galle,Bio Stream,"Presentation Skills, God Speaker","AWS VPC, Lambda, DynamoDB, API Gateway, CDK",1Y1S,2.2,3.2,"Kali Linux, Nmap, Python, Penetration Testing","Emotional Intelligence, Emotion-Tuned",DevOps / Cloud Engineer,90,4,3,3,4,5,4,8,8,9,1,7,Kinesthetic,,,,,,
Other,Kilinochchi,Arts Stream,"Leadership, Motivator","Docker Desktop, Git, Basic Linux Commands",2Y1S,2.4,3.3,"Node.js, Express.js","Teamwork, Powerful Unity",Data Science & Analytics,89,5,1,2,5,4,10,4,10,1,6,5,Visual,,,,,,
Female,Trincomalee,Arts Stream,"Leadership, Conflict Resolution, Negotiation","HTML, CSS, React.js, Node.js, MongoDB",2Y2S,2.9,3.2,"Figma, Canva, Basic UI/UX, Prototyping","Leadership, Quiet Authority",DevOps / Cloud Engineer,87,4,3,2,1,1,5,3,2,2,3,6,Visual,,,,,,
Male,Galle,Bio Stream,"Teamwork, Collaboration, Empathy","AWS Free Tier, S3, EC2",1Y1S,1.8,3.3,"C#, .NET Core, SQL Server, Git, Entity Framework","Communication, Respectful Speaker",DevOps / Cloud Engineer,68,5,2,4,3,4,4,10,9,6,10,2,Visual,,,,,,
Female,Vavuniya,Maths Stream,"Teamwork, Galactic Sync","Flutter, Dart, Firebase, GetX, REST APIs, App Publishing",1Y1S,2.7,3.3,"AWS, Docker, Kubernetes, Terraform, CI/CD","Communication, Rapport Building, Approachability;",Frontend / Web Developer,55,2,1,5,5,5,7,4,9,3,7,2,Aural,,,,,,
Female,Hambantota,Maths Stream,"Presentation Skills, Confidence, Poise","Python, Scikit-learn, Pandas, Jupyter, SQL",2Y2S,1.3,3,"Python Scripting, Metasploit, Kali Linux, OWASP;","Emotional Intelligence, Empathy, Compassion;",Data Science & Analytics,54,4,3,1,4,5,5,3,3,10,8,6,Kinesthetic,,,,,,
Female,Colombo,Technology Stream,"Teamwork, Galactic Sync","Python Scripting, Metasploit, Kali Linux, Network Security, Penetration Testing, SIEM",2Y2S,4,3.2,"Python, Jupyte","Presentation Skills, Elite Speaker",UI/UX Designer,45,1,3,3,1,5,3,6,1,6,10,2,Aural,,,,,,
Male,Mullaitivu,Arts Stream,"Time Management, Always On Time","Java, Python, Spring Boot, MySQL, Git",2Y1S,3.4,3,"Python, Scikit-learn, XGBoost, SQL, Model Deployment","Time Management, Efficiency, Focus;",Data Science & Analytics,48,2,3,3,1,1,10,1,6,7,1,6,Kinesthetic,,,,,,
Female,Nuwara Eliya,Maths Stream,"Time Management, Plans With Perfection","Python, Pandas, Google Colab",1Y2S,3.2,3,"Python, Pandas, Scikit-learn, TensorFlow, Statistics;","Presentation Skills, Lights Up the Room",DevOps / Cloud Engineer,69,4,2,2,3,2,3,4,4,9,1,3,Visual,,,,,,
Male,Galle,Maths Stream,"Leadership, Team Motivation, Conflict Resolution","Figma, Wireframing, Prototyping, User Research",1Y2S,2.1,3.2,"Figma, Adobe XD, Design Systems, User Testing, Accessibility;","Teamwork, Excellent Team Member",DevOps / Cloud Engineer,100,1,5,3,4,3,8,7,2,3,10,3,Visual,,,,,,
Female,Mullaitivu,Commerce Stream,"Teamwork, Planet-Level Cooperation","Python, Matplotlib",1Y1S,1.9,3.2,"Java, Python, Git","Teamwork, Energy Booster",Data Science & Analytics,77,1,4,4,5,3,10,3,10,10,10,5,Kinesthetic,,,,,,
Female,Badulla,Commerce Stream,"Teamwork, Trusted Collaborator","Flutter, Dart, Firebase Auth, GetX, Push Notifications",2Y1S,1,3.2,"Java, Python, Spring Boot, Git, Docker;","Communication, Love, Understanding;",UI/UX Designer,98,2,4,2,3,2,6,2,4,6,5,4,Kinesthetic,,,,,,
Female,Kandy,Bio Stream,"Communication, Transparency, Honesty","React.js, Node.js, Express.js, MongoDB, Git",1Y1S,4.9,3,"PyTorch, TensorFlow, Scikit-learn, Docker, MLflow;","Problem Solving, Calm Problem Breaker",Software Engineer / Backend,38,1,1,3,2,5,4,9,9,8,4,8,Kinesthetic,,,,,,
Male,Ratnapura,Bio Stream,"Communication, Articulate & Kind","Flutter, Dart, Firebase, GetX, App Deployment",2Y1S,4,3.2,"SQL, Excel, Power BI (Basic), Google Sheets, Pandas","Communication, Heart, Soul;",Frontend / Web Developer,86,4,1,5,2,1,7,4,1,8,5,7,Read/Write,,,,,,
Female,Mullaitivu,Technology Stream,"Critical Thinking, 9000 IQ","Python, Pandas, Scikit-learn, TensorFlow, SQL, Feature Engineering, Model Deployment",1Y2S,4,3.2,"Python, Google Colab, Scikit-learn, Pandas","Teamwork, Planet-Level Cooperation",Data Science & Analytics,47,3,2,4,5,3,5,3,3,2,1,5,Visual,,,,,,
Male,Ratnapura,Commerce Stream,"Leadership, Empowerment, Growth","TryHackMe, Nmap, Kali Linux",1Y1S,4.8,3.2,"SQL, Power BI, Python, Tableau, Statistics;","Public Speaking, Powerful Presence",DevOps / Cloud Engineer,48,4,4,2,4,2,6,4,3,10,6,1,Visual,,,,,,
Other,Colombo,Bio Stream,"Presentation Skills, Professional Delivery",AWS Free Tier,2Y2S,1.1,3,"Flutter, Dart, Firebase Auth, Bloc, Push Notifications;","Leadership, Infinite Potential",Data Science & Analytics,85,5,2,4,5,4,2,6,10,1,8,5,Visual,,,,,,
Male,Jaffna,Commerce Stream,"Presentation Skills, Influence, Power","SQL, Excel",1Y1S,1.8,3.3,"AWS Free Tier, EC2, S3","Teamwork, Support, Encouragement;",UI/UX Designer,95,2,1,4,3,1,6,7,6,2,1,4,Kinesthetic,,,,,,
Male,Kurunegala,Commerce Stream,"Problem Solving, Creative Fixer","MERN Stack, Redux, Docker, TypeScript, Git",1Y2S,2.2,3.3,"Figma, Wireframing, Prototyping, Accessibility","Emotional Intelligence, Soul Reader",Data Science & Analytics,83,3,1,3,1,2,5,6,7,1,2,7,Kinesthetic,,,,,,
Male,Colombo,Maths Stream,"Problem Solving, Resourceful","SQL, Python, Tableau, Power BI, Data Visualization",1Y1S,2.7,3.2,"HTML5, CSS3, React.js, Tailwind CSS, Git","Presentation Skills, Storytelling, Engagement;",DevOps / Cloud Engineer,43,2,4,2,4,3,2,4,4,5,6,9,Visual,,,,,,
Male,Monaragala,Maths Stream,"Leadership, Inspiration, Empowerment","HTML, CSS, React.js, MongoDB",2Y2S,2.6,3.2,"C++, Python, Git, Linux, Algorithms","Teamwork, Unites People",DevOps / Cloud Engineer,96,2,3,3,2,5,2,2,10,4,1,5,Visual,,,,,,
Male,Puttalam,Bio Stream,"Creativity, Modern Thinker","Wireshark, Nmap, Python, OWASP, Penetration Testing",1Y1S,1.9,3.2,"Python, Java, OOP, Data Structures & Algorithms, Git","Teamwork, Harmony Builder",AI / Machine Learning Engineer,73,2,4,1,5,2,3,8,10,4,2,1,Kinesthetic,,,,,,
Male,Polonnaruwa,Maths Stream,"Leadership, Visionary Thinking, Strategy","AWS, Serverless, Lambda, DynamoDB, API Gateway, CDK",2Y1S,4.4,3.2,"Figma, Canva, Prototyping","Communication, Flawless",Cybersecurity / Network Engineer,82,3,3,3,1,5,1,3,6,6,9,2,Visual,,,,,,
Female,Kilinochchi,Maths Stream,"Leadership, Natural Leader","HTML5, CSS3, JavaScript, React.js, Git",1Y1S,4.5,3.2,"Kubernetes, Helm, GitLab CI, Prometheus, Bash;","Adaptability, Change Management, Open-Mindedness",Data Science & Analytics,95,4,5,2,2,3,7,4,3,2,6,3,Visual,,,,,,
Male,Badulla,Technology Stream,"Problem Solving, Innovation, Future","Kubernetes, Docker, GitOps, ArgoCD, Prometheus, Grafana, Linux",2Y1S,3.2,3.3,"Figma, Prototyping, User Personas, Journey Mapping, Usability Testing;","Adaptability, Learning Mindset, Growth;",AI / Machine Learning Engineer,75,1,5,5,3,2,10,10,8,3,2,4,Kinesthetic,,,,,,
Male,Vavuniya,Maths Stream,"Adaptability, Thrives Anywhere","Figma, Adobe XD, Design Systems, Accessibility",1Y2S,2.1,3.2,"Git, Docker Desktop","Problem Solving, Infinite Solver",Data Science & Analytics,48,1,5,5,3,3,9,6,6,2,1,5,Kinesthetic,,,,,,
Other,Kandy,Technology Stream,"Problem Solving, Calm Problem Breaker","Figma, Prototyping, User Flows, Design Thinking",1Y1S,3,2.8,"Docker, Kubernetes, Jenkins, Terraform, Linux Admin;","Communication, Clear Thought Flow",IT / Technology Generalist,89,3,3,3,5,3,1,1,10,3,7,6,Visual,,,,,,
Female,Matale,Bio Stream,"Teamwork, Powerful Unity","SQL, Excel",2Y1S,3.7,3.2,"React.js, Node.js, Express.js, MongoDB, Git","Public Speaking, Powerful Presence",UI/UX Designer,63,2,1,4,3,4,7,4,10,9,5,10,Visual,,,,,,
Other,Mannar,Bio Stream,"Emotional Intelligence, Exceptional","SQL, Power BI, Python, Statistics, Tableau",1Y1S,1,3,"Flutter, Dart, Firebase, Bloc, Push Notifications","Problem Solving, Breaks Every Code",DevOps / Cloud Engineer,84,3,4,2,1,1,3,4,1,8,10,3,Kinesthetic,,,,,,
Female,Vavuniya,Maths Stream,"Creativity, Innovation, Risk-Taking","Adobe XD, Figma, Framer, Design Thinking, Prototyping",1Y1S,1,3.3,"PyTorch, TensorFlow, Scikit-learn, FastAPI","Creativity, Vision, Imagination;",Frontend / Web Developer,87,4,2,3,2,2,6,1,5,9,8,2,Kinesthetic,,,,,,
Female,Gampaha,Bio Stream,"Time Management, Perfect Planning","React.js, Node.js, MongoDB, Express.js, Git",1Y1S,2.2,3,"Kali Linux, Nmap, Python, Penetration Testing","Emotional Intelligence, Exceptional",Frontend / Web Developer,85,5,4,4,4,4,6,1,3,10,5,3,Visual,,,,,,
Other,Jaffna,Commerce Stream,"Time Management, Efficiency, Focus","AWS EC2, Lambda, S3, DynamoDB, API Gateway, CDK, Terraform",2Y1S,4.9,3,"Python, Java, Git, MySQL, Spring Boot;","Problem Solving, Decision Making, Logic;",Data Science & Analytics,52,3,4,2,1,2,6,8,1,2,9,8,Read/Write,,,,,,
Male,Kandy,Arts Stream,"Communication, Active Listener","MERN Stack, Redux, Docker, Git, Firebase, REST APIs",2Y2S,4.8,3.2,"MERN Stack, Docker, Git, Redux, Postman","Creativity, Artistic Brain",DevOps / Cloud Engineer,99,5,1,5,3,5,9,6,8,8,4,5,Visual,,,,,,
Male,Kegalle,Maths Stream,"Problem Solving, Calm Problem Breaker","TensorFlow, PyTorch, FastAPI, Docker, AWS",1Y1S,1.5,3,"Kali Linux Basics, Nmap, Wireshark, TryHackMe, Burp Suite Community","Emotional Intelligence, Self-Regulation, Motivation;",Data Science & Analytics,57,2,1,5,2,5,9,5,3,6,4,5,Visual,,,,,,
Male,Colombo,Bio Stream,"Emotional Intelligence, Nirvana, Bliss","Node.js, Express.js, MongoDB",1Y2S,1.8,3.3,"SQL, Pandas, Power BI, Excel, Data Cleaning","Teamwork, Collaboration, Empathy",Frontend / Web Developer,92,1,5,5,3,3,1,10,4,6,8,10,Visual,,,,,,
Female,Monaragala,Commerce Stream,"Adaptability, Learning Mindset, Growth","React.js, Node.js, Express.js, MongoDB, Git, Docker",1Y2S,4.5,3.3,"Java, Python, Spring Boot, Git, Docker","Time Management, Perfect Planning",Cybersecurity / Network Engineer,47,3,5,3,4,2,8,4,9,1,1,9,Visual,,,,,,
Male,Matara,Commerce Stream,"Adaptability, Unbreakable","Node.js, NestJS, TypeScript, PostgreSQL, GraphQL, Docker",2Y2S,2.9,3.3,"AWS, Docker, Kubernetes, Terraform, Ansible","Teamwork, Unites Every Team",Data Science & Analytics,61,1,4,1,2,2,10,5,3,4,8,1,Aural,,,,,,
Female,Kilinochchi,Arts Stream,"Communication, Sonic Clarity","Figma, Canva, Basic UI",2Y1S,1.1,3.2,"AWS VPC, IAM, ECS, CloudWatch, Terraform;","Public Speaking, Charisma, Presence;",Frontend / Web Developer,95,4,2,1,3,2,9,7,6,3,3,2,Read/Write,,,,,,
Male,Polonnaruwa,Bio Stream,"Leadership, Inspiring Star",AWS Free Tier,1Y2S,3,2.8,"Java, Python, VS Code, Git, GitHub","Critical Thinking, Insight, Perception;",DevOps / Cloud Engineer,67,2,3,1,1,5,5,2,6,2,2,9,Read/Write,,,,,,
